{
  "$schema": "http://json-schema.org/draft-07/schema",
  "$id": "sponsorship",

  "type": "object",
  "required": ["action", "sponsorship", "sender"],
  "properties": {
    "action": {
      "type": "string",
      "enum": [
        "created",
        "cancelled",
        "edited",
        "tier_changed",
        "pending_cancellation",
        "pending_tier_change"
      ]
    },
    "sponsorship": {
      "type": "object",
      "required": [
        "node_id",
        "created_at",
        "sponsorable",
        "sponsor",
        "privacy_level",
        "tier"
      ],
      "properties": {
        "node_id": {
          "type": "string"
        },
        "created_at": {
          "type": "string"
        },
        "sponsorable": {
          "type": "object",
          "required": [
            "login",
            "id",
            "node_id",
            "avatar_url",
            "gravatar_id",
            "url",
            "html_url",
            "followers_url",
            "following_url",
            "gists_url",
            "starred_url",
            "subscriptions_url",
            "organizations_url",
            "repos_url",
            "events_url",
            "received_events_url",
            "type",
            "site_admin"
          ],
          "properties": {
            "login": {
              "type": "string"
            },
            "id": {
              "type": "integer"
            },
            "node_id": {
              "type": "string"
            },
            "avatar_url": {
              "type": "string"
            },
            "gravatar_id": {
              "type": "string"
            },
            "url": {
              "type": "string"
            },
            "html_url": {
              "type": "string"
            },
            "followers_url": {
              "type": "string"
            },
            "following_url": {
              "type": "string"
            },
            "gists_url": {
              "type": "string"
            },
            "starred_url": {
              "type": "string"
            },
            "subscriptions_url": {
              "type": "string"
            },
            "organizations_url": {
              "type": "string"
            },
            "repos_url": {
              "type": "string"
            },
            "events_url": {
              "type": "string"
            },
            "received_events_url": {
              "type": "string"
            },
            "type": {
              "type": "string"
            },
            "site_admin": {
              "type": "boolean"
            }
          },
          "additionalProperties": false
        },
        "sponsor": {
          "type": "object",
          "required": [
            "login",
            "id",
            "node_id",
            "avatar_url",
            "gravatar_id",
            "url",
            "html_url",
            "followers_url",
            "following_url",
            "gists_url",
            "starred_url",
            "subscriptions_url",
            "organizations_url",
            "repos_url",
            "events_url",
            "received_events_url",
            "type",
            "site_admin"
          ],
          "properties": {
            "login": {
              "type": "string"
            },
            "id": {
              "type": "integer"
            },
            "node_id": {
              "type": "string"
            },
            "avatar_url": {
              "type": "string"
            },
            "gravatar_id": {
              "type": "string"
            },
            "url": {
              "type": "string"
            },
            "html_url": {
              "type": "string"
            },
            "followers_url": {
              "type": "string"
            },
            "following_url": {
              "type": "string"
            },
            "gists_url": {
              "type": "string"
            },
            "starred_url": {
              "type": "string"
            },
            "subscriptions_url": {
              "type": "string"
            },
            "organizations_url": {
              "type": "string"
            },
            "repos_url": {
              "type": "string"
            },
            "events_url": {
              "type": "string"
            },
            "received_events_url": {
              "type": "string"
            },
            "type": {
              "type": "string"
            },
            "site_admin": {
              "type": "boolean"
            }
          },
          "additionalProperties": false
        },
        "privacy_level": {
          "type": "string"
        },
        "tier": {
          "type": "object",
          "required": [
            "node_id",
            "created_at",
            "description",
            "monthly_price_in_cents",
            "monthly_price_in_dollars",
            "name"
          ],
          "properties": {
            "node_id": {
              "type": "string"
            },
            "created_at": {
              "type": "string"
            },
            "description": {
              "type": "string"
            },
            "monthly_price_in_cents": {
              "type": "integer"
            },
            "monthly_price_in_dollars": {
              "type": "integer"
            },
            "name": {
              "type": "string"
            }
          },
          "additionalProperties": false
        }
      },
      "additionalProperties": false
    },
    "effective_date": {
      "type": "string"
    },
    "changes": {
      "type": "object",
      "required": ["tier"],
      "properties": {
        "tier": {
          "type": "object",
          "required": ["from"],
          "properties": {
            "from": {
              "type": "object",
              "required": [
                "node_id",
                "created_at",
                "description",
                "monthly_price_in_cents",
                "monthly_price_in_dollars",
                "name"
              ],
              "properties": {
                "node_id": {
                  "type": "string"
                },
                "created_at": {
                  "type": "string"
                },
                "description": {
                  "type": "string"
                },
                "monthly_price_in_cents": {
                  "type": "integer"
                },
                "monthly_price_in_dollars": {
                  "type": "integer"
                },
                "name": {
                  "type": "string"
                }
              },
              "additionalProperties": false
            }
          },
          "additionalProperties": false
        }
      },
      "additionalProperties": false
    },
    "sender": {
      "$ref": "common/user.schema.json"
    }
  },
  "additionalProperties": false
}
