{
    "action": "pending_tier_change",
    "sponsorship": {
        "node_id": "MDExOlNwb25zb3JzaGlwMQ==",
        "created_at": "2019-12-20T19:24:46+00:00",
        "sponsorable": {
            "login": "octocat",
            "id": 5,
            "node_id": "MDQ6VXNlcjU=",
            "avatar_url": "https://avatars2.githubusercontent.com/u/5?",
            "gravatar_id": "",
            "url": "https://api.github.com/users/octocat",
            "html_url": "https://github.com/octocat",
            "followers_url": "https://api.github.com/users/octocat/followers",
            "following_url": "https://api.github.com/users/octocat/following{/other_user}",
            "gists_url": "https://api.github.com/users/octocat/gists{/gist_id}",
            "starred_url": "https://api.github.com/users/octocat/starred{/owner}{/repo}",
            "subscriptions_url": "https://api.github.com/users/octocat/subscriptions",
            "organizations_url": "https://api.github.com/users/octocat/orgs",
            "repos_url": "https://api.github.com/users/octocat/repos",
            "events_url": "https://api.github.com/users/octocat/events{/privacy}",
            "received_events_url": "https://api.github.com/users/octocat/received_events",
            "type": "User",
            "site_admin": false
        },
        "sponsor": {
            "login": "monalisa",
            "id": 2,
            "node_id": "MDQ6VXNlcjI=",
            "avatar_url": "https://avatars2.githubusercontent.com/u/2?",
            "gravatar_id": "",
            "url": "https://api.github.com/users/monalisa",
            "html_url": "https://github.com/monalisa",
            "followers_url": "https://api.github.com/users/monalisa/followers",
            "following_url": "https://api.github.com/users/monalisa/following{/other_user}",
            "gists_url": "https://api.github.com/users/monalisa/gists{/gist_id}",
            "starred_url": "https://api.github.com/users/monalisa/starred{/owner}{/repo}",
            "subscriptions_url": "https://api.github.com/users/monalisa/subscriptions",
            "organizations_url": "https://api.github.com/users/monalisa/orgs",
            "repos_url": "https://api.github.com/users/monalisa/repos",
            "events_url": "https://api.github.com/users/monalisa/events{/privacy}",
            "received_events_url": "https://api.github.com/users/monalisa/received_events",
            "type": "User",
            "site_admin": true
        },
        "privacy_level": "private",
        "tier": {
            "node_id": "MDEyOlNwb25zb3JzVGllcjE=",
            "created_at": "2019-12-20T19:17:05Z",
            "description": "foo",
            "monthly_price_in_cents": 500,
            "monthly_price_in_dollars": 5,
            "name": "$5 a month"
        }
    },
    "changes": {
        "tier": {
            "from": {
                "node_id": "MDEyOlNwb25zb3JzVGllcjI=",
                "created_at": "2019-12-20T19:26:26Z",
                "description": "bar",
                "monthly_price_in_cents": 1000,
                "monthly_price_in_dollars": 10,
                "name": "$10 a month"
            }
        }
    },
    "effective_date": "2019-12-30T00:00:00+00:00",
    "sender": {
        "login": "monalisa",
        "id": 2,
        "node_id": "MDQ6VXNlcjI=",
        "avatar_url": "https://avatars2.githubusercontent.com/u/2?",
        "gravatar_id": "",
        "url": "https://api.github.com/users/monalisa",
        "html_url": "https://github.com/monalisa",
        "followers_url": "https://api.github.com/users/monalisa/followers",
        "following_url": "https://api.github.com/users/monalisa/following{/other_user}",
        "gists_url": "https://api.github.com/users/monalisa/gists{/gist_id}",
        "starred_url": "https://api.github.com/users/monalisa/starred{/owner}{/repo}",
        "subscriptions_url": "https://api.github.com/users/monalisa/subscriptions",
        "organizations_url": "https://api.github.com/users/monalisa/orgs",
        "repos_url": "https://api.github.com/users/monalisa/repos",
        "events_url": "https://api.github.com/users/monalisa/events{/privacy}",
        "received_events_url": "https://api.github.com/users/monalisa/received_events",
        "type": "User",
        "site_admin": true
    }
}
